2,ไส้แฟ้ม 11 รู A4 1แพ็ค /5ซอง,11,5,25,3,25,0.05,15
2,ไส้แม็ก 8-1M,4,5,25,3,25,0.05,53
2,ไส้แม็ก10-1M,5,5,25,3,25,0.05,8
2,ไส้แม็ก3-1M,45,5,25,3,25,0.05,20
2,ไส้แม็ก35-1M,18,5,25,3,25,0.05,34.7
3,หนังยางวงเล็ก 1 กก,1,5,25,3,25,0.05,62
5,หน้ากากอนามัย,24,5,25,3,25,0.05,1.5
4,หม้อน้ำรถตู้ KDH222,0,5,25,3,25,0.05,7890
4,หม้อแบตเตอร์รี่,1,5,25,3,25,0.05,2220
4,หม้อลมเบรค HINO,0,5,25,3,25,0.05,4750
4,หม้อลมเบรค เสริม KDH222,0,5,25,3,25,0.05,650
2,หมึกCANNON-CF283A,1,5,25,3,25,0.05,750
2,หมึกCANON 6030-285A,9,5,25,3,25,0.05,580
2,หมึกเติมตลับแดง,4,5,25,3,25,0.05,11
2,หมึกเติมตลับน้ำเงิน,1,5,25,3,25,0.05,11
2,หมึกเติมไวท์บอร์ด(แดง),6,5,25,3,25,0.05,44
2,หมึกเติมไวท์บอร์ด(น้ำเงิน),4,5,25,3,25,0.05,44
2,หมุดสีเย็บกระดาษ,2,5,25,3,25,0.05,27
3,หมูยอ,0,5,25,3,25,0.05,210
3,หลอดน้ำปั่น,10,5,25,3,25,0.05,5
4,หลอดไฟ H1 24V,21,5,25,3,25,0.05,69
4,หลอดไฟ H3 24/70W,5,5,25,3,25,0.05,79
4,หลอดไฟ H4 12V,2,5,25,3,25,0.05,85
4,หลอดไฟ24V/1จุด (เล็ก),5,5,25,3,25,0.05,12
4,หลอดไฟ24V/1จุด25W (ใหญ่),9,5,25,3,25,0.05,12
4,หลอดไฟ24V/2จุด,6,5,25,3,25,0.05,12
4,หลอดไฟ24V/2จุด 25/10W,9,5,25,3,25,0.05,12
4,หลอดไฟ24V12W(สแกนเนีย),20,5,25,3,25,0.05,17
4,หลอดไฟ2จุด12V(ใหญ่),12,5,25,3,25,0.05,12
4,หลอดไฟกลม(ขาว),114,5,25,3,25,0.05,46
4,หลอดไฟกลม(ส้ม),8,5,25,3,25,0.05,46
4,หลอดไฟกลมขาว(ใหญ่),9,5,25,3,25,0.05,0
4,หลอดไฟตัดหมอก 26W (รถตู้),6,5,25,3,25,0.05,190
4,หลอดไฟในกันชน KDH222/12V,5,5,25,3,25,0.05,790
4,หลอดไฟเบรค VIGO เขี้ยวเยือง 12V,5,5,25,3,25,0.05,21
4,หลอดไฟฟิวส์ 24V 5W,1,5,25,3,25,0.05,11
4,หลอดไฟฟิวส์ 24v10w (สแกนเนีย),22,5,25,3,25,0.05,32
4,หลอดไฟยาว(ขาว),0,5,25,3,25,0.05,144
4,หลอดไฟยาว+ราง(ขาว),39,5,25,3,25,0.05,147
4,หลอดไฟเสียบโต 12 V 1 จุด 21W(สีส้ม),7,5,25,3,25,0.05,22
4,หลอดไฟเสียบโต 12V 1 จุด 21W,0,5,25,3,25,0.05,22
4,หลอดไฟเสียบโต 12V 2จุด 21/5W,13,5,25,3,25,0.05,22
4,หลอดไฟหน้า H4 (รถตู้),4,5,25,3,25,0.05,84
4,หลอดไฟหน้า12V/24w(รถตู้),9,5,25,3,25,0.05,210
4,หลอดไฟหน้าปัดเสียบโต 12V (รถตู้),6,5,25,3,25,0.05,22
4,หลอดไฟหรี่ T10LIFE (รถตู้),14,5,25,3,25,0.05,16
3,หลอดยาว,11,5,25,3,25,0.05,14
3,หลอดสั้น,28,5,25,3,25,0.05,8
4,หลอนนีออนLED 18w,5,5,25,3,25,0.05,370
4,หวีคลัช 11 นิ้ว KDH223,0,5,25,3,25,0.05,2550
4,หวีคลัช KDH222 VIGO 1/4,0,5,25,3,25,0.05,2530
4,หัวแป๊บลม เบอร์ 19,0,5,25,3,25,0.05,0
4,หัวแป๊บลม เบอร์ 27,0,5,25,3,25,0.05,0
4,หัวศรแอร์ 134A,10,5,25,3,25,0.05,37
4,หัวหมูเครื่อง HO7D,0,5,25,3,25,0.05,5250
4,หางปลา เบอร์ 10,0,5,25,3,25,0.05,3
4,หางปลา เบอร์10,0,5,25,3,25,0.05,6
4,หางปลา เบอร์8,0,5,25,3,25,0.05,0
4,เหล็กกันโคลงหน้าพร้อมลูกหมาก KDH222,0,5,25,3,25,0.05,3990
4,เหล็กกั้นหนังสือ,2,5,25,3,25,0.05,39.5
4,เหล็กเจาะรู,0,5,25,3,25,0.05,10.5
4,เหล็กรองรางเลื่อนประตู T/T COMMUTER (ขวา),0,5,25,3,25,0.05,1260
4,เหล็กเสียบบิล,25,5,25,3,25,0.05,16
4,แหนบ  ตัวที่ 5,0,5,25,3,25,0.05,2850
4,แหนบกอดหู KDH222,0,5,25,3,25,0.05,1370
4,แหนบหน้า บัส 200 แรง,0,5,25,3,25,0.05,2950
4,แหนบหน้าตัวที่ 3 ISUZU,0,5,25,3,25,0.05,1400
4,แหนบหนาล่าง KDH222,0,5,25,3,25,0.05,550
4,แหนบหู BUS,0,5,25,3,25,0.05,2750
4,แหนม,0,5,25,3,25,0.05,15
4,แหวนรองสกรู,0,5,25,3,25,0.05,0.53
4,แหวนรองสลักแหนบ KT 725,0,5,25,3,25,0.05,9
4,แหวนลองบุ๊ทแหนบ,0,5,25,3,25,0.05,11
4,แหวนลองสลัก KT,0,5,25,3,25,0.05,6
3,ออริกาโน่,0,5,25,3,25,0.05,178
4,ไฮโดรลิคดันสายพาน VIGO,12,5,25,3,25,0.05,720
