2,ปากกาเน้นคำ,29,5,25,3,25,0.05,12
2,ปากกาเมจิกแดง,5,5,25,3,25,0.05,10
2,ปากกาเมจิกน้ำเงิน,5,5,25,3,25,0.05,10
2,ปากกาเมจิกเหลือง,20,5,25,3,25,0.05,10
2,ปากกาลบคำผิด,12,5,25,3,25,0.05,21
2,ปากกาไวท์บอร์ด น้ำเงิน,16,5,25,3,25,0.05,17
2,ปากกาไวท์บอร์ดดำ,41,5,25,3,25,0.05,17
2,ปากกาไวท์บอร์ดแดง,28,5,25,3,25,0.05,17
2,ปากกาหมึกซึม(แดง),0,5,25,3,25,0.05,15
2,ป้ายชื่อ,0,5,25,3,25,0.05,0
4,ปุ่มกดสตาร์ท,1,5,25,3,25,0.05,0
4,ปุ่มสตาร์ท 024211,0,5,25,3,25,0.05,0
3,แป้งข้าวเจ้า,0,5,25,3,25,0.05,37
3,แป้งทอดกรอบ,6,5,25,3,25,0.05,34
3,แป้งมันสับปะหลัง,6,5,25,3,25,0.05,18
3,แป๊ปซี่(กระป๋อง),0,5,25,3,25,0.05,10
1,แปรงขัดพื้น,0,5,25,3,25,0.05,69
1,แปรงซักผ้าขนแข็ง,0,5,25,3,25,0.05,0
1,แปรงซักผ้าขนอ่อน,0,5,25,3,25,0.05,16
2,แปรงลบกระดาน,7,5,25,3,25,0.05,13
1,แปรงล้างโถส้วม,9,5,25,3,25,0.05,30
4,แปลงทาสี,0,5,25,3,25,0.05,31.5
2,โปรแจ๊คเตอร์ พร้อมจอ 1 ชุด,0,5,25,3,25,0.05,0
1,ผงvanish,24,5,25,3,25,0.05,12.6
3,ผงโกโก้,0,5,25,3,25,0.05,205
3,ผงชูรส,4,5,25,3,25,0.05,93
1,ผงซักฟอก 8กก*1,1,5,25,3,25,0.05,300
4,ผงอุดรอยรั่วซึมหม้อน้ำ,1,5,25,3,25,0.05,79
3,ผักรวมแช่,0,5,25,3,25,0.05,62
5,ผ้าก๊อซฟามาแคร์2*2,5,5,25,3,25,0.05,7
1,ผ้าเช็ดรถ,1858,5,25,3,25,0.05,15
4,ผ้าเต็นคลุมหลังคารถ,0,5,25,3,25,0.05,250
1,ผ้าถูพื้น(อะไหล่ม็อบ),7,5,25,3,25,0.05,40
1,ผ้าถูพื้น(อะไหล่ม๊อบหัวกลม),3,5,25,3,25,0.05,47.5
4,"ผ้าเบรค HINO FM,FL (186HP)-R (12รู)",24,5,25,3,25,0.05,1260
4,ผ้าเบรค HINO FM-R 47443-1540(12รู),0,5,25,3,25,0.05,500
4,ผ้าเบรค SSP-2317 LH 112-R,0,5,25,3,25,0.05,0
4,ผ้าเบรคมือ HINO FC,0,5,25,3,25,0.05,525
4,"ผ้าเบรคหน้า HINO RF , ZM5 -F8 รู 47441-3180",16,5,25,3,25,0.05,1690
4,ผ้าเบรคหน้า SP 680 (รถตู้),27,5,25,3,25,0.05,1190
4,ผ้าเบรคหน้า SP-183,3,5,25,3,25,0.05,1970
4,ผ้าเบรคหน้า SP-690(สี่ล้อแดง),5,5,25,3,25,0.05,1184
4,ผ้าเบรคหน้า ยามาฮ่า,0,5,25,3,25,0.05,126
4,ผ้าเบรคหน้า(REVO) SP 694,8,5,25,3,25,0.05,566
4,ผ้าเบรคหลัง (REVO) SSP 2369,5,5,25,3,25,0.05,113
4,"ผ้าเบรคหลัง HINO RF 720,820 RSR 47441-2940 12รู",0,5,25,3,25,0.05,1730
4,"ผ้าเบรคหลัง HINO ZM8,RC-เสือเพา-R47441-4240 (12รู)",18,5,25,3,25,0.05,1820
4,ผ้าเบรคหลัง SSP2305,20,5,25,3,25,0.05,2284
4,ผ้าเบรคหลัง SSP-2317,0,5,25,3,25,0.05,0
4,ผ้าเบรคหลัง SSP-2367 I,0,5,25,3,25,0.05,1310
4,ผ้าเบรคหลัง SSP-2370,17,5,25,3,25,0.05,1500
4,ผ้าเบรคหลัง SSP-252,0,5,25,3,25,0.05,0
4,ผ้าเบรคหลัง ยามาฮ่า,0,5,25,3,25,0.05,100
3,ผ้าเย็นซอง ไฮเฟรช เช้นท์ 5*8,0,5,25,3,25,0.05,120
2,ผ้ารองหัวเบาะ,0,5,25,3,25,0.05,1
4,ผ้าหน้าเบรคหน้า ISUZU JUMBO FX2 (1รู),0,5,25,3,25,0.05,0
4,แผงกันจราจร,0,5,25,3,25,0.05,1250
2,แผ่นCOPY,7,5,25,3,25,0.05,137
4,แผ่นกันความร้อน,0,5,25,3,25,0.05,380
4,แผ่นคลัช 11 นิ้ว KDH223,0,5,25,3,25,0.05,3150
4,แผ่นคลัช 11 นิ้ว รถตู้ (REVO),1,5,25,3,25,0.05,2890
4,แผ่นคลัช 13นิ้ว 10ฟัน,0,5,25,3,25,0.05,2650
4,แผ่นคลัช VIGO 1/4,0,5,25,3,25,0.05,2630
4,แผ่นเจียร์บาง 4 นิ้ว,10,5,25,3,25,0.05,27
4,แผ่นตัดไฟเบอร์ 4 นิ้ว,2,5,25,3,25,0.05,26
4,แผ่นรองซับซอฟแท็ก,0,5,25,3,25,0.05,92
1,ฝอยขัดหม้อ,13,5,25,3,25,0.05,6
3,ฝาแก้ว 16 ออน,6,5,25,3,25,0.05,32
4,ฝาปั๊มโซล่า,0,5,25,3,25,0.05,0
4,ฝาปิดน้ำมันเครื่อง,1,5,25,3,25,0.05,0
4,ฝาหม้อน้ำ BIG M,1,5,25,3,25,0.05,75
2,พรบ.สี่เหลี่ยม,0,5,25,3,25,0.05,0
1,พรมเช็ดเท้า,0,5,25,3,25,0.05,16
3,พริกไทย,2,5,25,3,25,0.05,51
3,พริกน้ำตาล,12,5,25,3,25,0.05,30
3,พริกน้ำปลา,12,5,25,3,25,0.05,40
3,พริกน้ำส้ม,8,5,25,3,25,0.05,27
3,พริกป่น,7,5,25,3,25,0.05,83
2,พลาสติกเคลือบบัตร,1,5,25,3,25,0.05,280
4,พัดลม,0,5,25,3,25,0.05,840
4,พัดลมโบลเวอร์แอร์ รถตู้ (ตู้หน้า),8,5,25,3,25,0.05,1170
4,พัดลมโบลเวอร์แอร์ตู้หลัง (ขวา),6,5,25,3,25,0.05,1200
4,พัดลมโบลเวอร์แอร์ตู้หลัง (ซ้าย),6,5,25,3,25,0.05,1200
4,พัดลมหม้อน้ำ 12นิ้ว 24V,0,5,25,3,25,0.05,1100
5,พาสเตอร์,244,5,25,3,25,0.05,2
4,เพลาข้าง รถตู้,1,5,25,3,25,0.05,9450
4,เพลาท้ายZM,0,5,25,3,25,0.05,25200
4,เพาเวอร์ (Austika 90.4),0,5,25,3,25,0.05,1900
1,ฟ๊อกกี้ฉีดน้ำ,6,5,25,3,25,0.05,19
1,ฟองน้ำล้างรถ(เล็ก),0,5,25,3,25,0.05,9
1,ฟองน้ำล้างรถ(ใหญ่),0,5,25,3,25,0.05,20
3,ฟิมส์ธนอมอาหาร,0,5,25,3,25,0.05,32
4,ฟิวเมน 100A,0,5,25,3,25,0.05,42
4,ฟิวส์ 10 A ใหญ่,5,5,25,3,25,0.05,5
4,ฟิวส์ 15 A ใหญ่,0,5,25,3,25,0.05,5
4,ฟิวส์ 20 A ใหญ่,7,5,25,3,25,0.05,5
4,ฟิวส์ 30A,7,5,25,3,25,0.05,5
4,ฟิวส์ 5 A ใหญ่,0,5,25,3,25,0.05,5
4,ฟิวส์เล็ก (10แอมป์),5,5,25,3,25,0.05,7
4,ฟิวส์เล็ก (15แอมป์),9,5,25,3,25,0.05,7
4,ฟิวส์เล็ก (20แอมป์),6,5,25,3,25,0.05,7
4,ฟิวส์เล็ก (25แอมป์),1,5,25,3,25,0.05,7
4,ฟิวส์เล็ก( 30แอมป์),4,5,25,3,25,0.05,7
4,เฟรซเซอร์ไฟเลี้ยวบัส,1,5,25,3,25,0.05,0
3,เฟรนฟราย,0,5,25,3,25,0.05,163
4,เฟือง ABS KDH 222,1,5,25,3,25,0.05,425
4,เฟืองเกียร์ 3-4 KDH222 (เฟืองเต็ม),0,5,25,3,25,0.05,3680
4,เฟืองเกียร์5 KDH222,0,5,25,3,25,0.05,850
4,เฟืองท้าย KDH 222,0,5,25,3,25,0.05,7400
4,เฟืองปลอกเลื่อน 3-4 (รถตู้),1,5,25,3,25,0.05,3045
2,แฟ้มซอง A4(ถนอมเอกสาร),11,5,25,3,25,0.05,35
2,แฟ้มซองเอกสารA4,4,5,25,3,25,0.05,32
2,แฟ้มสันกว้างปกดำ2,6,5,25,3,25,0.05,279
4,ไฟกระพริบ,3,5,25,3,25,0.05,48
2,ไฟฉาย (ธรรมดา),7,5,25,3,25,0.05,37
2,ไฟฉาย ZG-806,1,5,25,3,25,0.05,73
2,ไฟแช็ค,56,5,25,3,25,0.05,5
4,ไฟตัดหมอกขวา,5,5,25,3,25,0.05,1050
4,ไฟตัดหมอกซ้าย,4,5,25,3,25,0.05,1050
4,ไฟถอย S68,1,5,25,3,25,0.05,135
4,ไฟท้าย LED สีส้ม,5,5,25,3,25,0.05,0
4,ไฟท้ายรูปไผ่ทานตะวัน ฝาช้อน (แดง-เหลือง),6,5,25,3,25,0.05,0
4,ไฟเลี้ยว 0404(เหลือง),9,5,25,3,25,0.05,0
4,ไฟเลี้ยว 0560 เหลือง 24V,1,5,25,3,25,0.05,126
4,ไฟเลี้ยว 0560(น้ำเงิน) 24 V,3,5,25,3,25,0.05,116
4,ไฟเลี้ยวข้าง(สแกนเนีย),3,5,25,3,25,0.05,105
4,ไฟสปอตไลท์ 24V,2,5,25,3,25,0.05,263
4,ไฟส่องป้ายTS351(ยาว8),7,5,25,3,25,0.05,158
4,ไฟส่องป้ายสะท้อนแสง 24V,3,5,25,3,25,0.05,79
4,ไฟหลังคา KO-302,8,5,25,3,25,0.05,63
3,มาม่าคัพ,22,5,25,3,25,0.05,15
3,มาม่าต้มยำกุ้ง 55 กรัม,2,5,25,3,25,0.05,204
3,มาม่าหมูสับ60กรัม,0,5,25,3,25,0.05,204
3,มายองเนส,0,5,25,3,25,0.05,67
3,มิกซ์เฟรชแอร์มะนาว+น้ำส้ม,0,5,25,3,25,0.05,36
2,มีดคัตเตอร์,3,5,25,3,25,0.05,21
4,มือเปิด kk,6,5,25,3,25,0.05,590
4,มือเปิดฝาข้างบัส,1,5,25,3,25,0.05,615
4,มู่เล่ 4156 (ไม่มีลูกปืน),1,5,25,3,25,0.05,420
4,มูเล่ไดชาร์ (รถตู้),3,5,25,3,25,0.05,241.5
4,มู่เล่ย์ VIGO แปลง,3,5,25,3,25,0.05,0
2,แม็กเย็บ(เล็ก),1,5,25,3,25,0.05,51
2,แม็กเย็บ(ใหญ่),1,5,25,3,25,0.05,116
4,แม่แรง6ตัน,3,5,25,3,25,0.05,504
1,ไม้กวาด(ยาว),5,5,25,3,25,0.05,34
1,ไม้กวาด(สั้น),1,5,25,3,25,0.05,30
1,ไม้กวาดทางมะพร้าว,0,5,25,3,25,0.05,37
1,ไม้กวาดรีดน้ำ,3,5,25,3,25,0.05,241.5
1,ไม้กวาดหยากไย่,0,5,25,3,25,0.05,105
1,ไม้ขนไก่,3,5,25,3,25,0.05,76
4,ไมค์ลอย(M-MAX 339 KU),0,5,25,3,25,0.05,4000
3,ไม้จิ้มฟัน,2,5,25,3,25,0.05,25
1,ไม้เช็ดกระจกรถ(สแกนเนีย),0,5,25,3,25,0.05,90
2,ไม้เซลฟี่,1,5,25,3,25,0.05,0
1,ไม้ถูพื้น,0,5,25,3,25,0.05,136
2,ไม้บรรทัด,6,5,25,3,25,0.05,16
4,ยอยเพลากลางZM,0,5,25,3,25,0.05,2650
5,ยาแก้ท้องเสีย,27,5,25,3,25,0.05,14
5,ยาแก้ปวด,18,5,25,3,25,0.05,10
5,ยาแก้เมารถไดเมน,78,5,25,3,25,0.05,6
4,ยาง 825 พร้อมยางใน+ยางรอง,4,5,25,3,25,0.05,5550
4,ยางกันกระแทกล่าง KDH222,0,5,25,3,25,0.05,150
4,ยางกันกระแทกหลัง KDH222,1,5,25,3,25,0.05,158
4,ยางกันกระแทรกหน้า KT725 FM18 (รถเมล์),7,5,25,3,25,0.05,170
4,ยางกันโคลง KDH222,4,5,25,3,25,0.05,79
4,ยางกันฝุ่น  (แหวนเล็ก),0,5,25,3,25,0.05,0
4,ยางกันฝุ่น (แหวนใหญ่),5,5,25,3,25,0.05,28
4,ยางกันฝุ่นดิสเบรค KDH222 (ตัวหนอน),19,5,25,3,25,0.05,27
4,ยางกันฝุ่นเบรค R FM ใหญ่ 47536-1200B,0,5,25,3,25,0.05,21
4,ยางกันฝุ่นเบรคSC 47536-1201,0,5,25,3,25,0.05,27
4,ยางกันฝุ่นเบรครถตู้  SC-144611-10060,8,5,25,3,25,0.05,32
4,ยางกันฝุ่นปลอกหัวฉีด,3,5,25,3,25,0.05,45
4,ยางขอบประตูเลื่อน(รถตู้),0,5,25,3,25,0.05,1270
4,ยางครอบเกียร(รถตู้),4,5,25,3,25,0.05,29.4
4,ยางแคมป์ปิ้ง,10,5,25,3,25,0.05,0
4,"ยางโช๊คอัพ เตเปอร์1"" รถเมล์",2,5,25,3,25,0.05,19
4,ยางปัดน้ำฝน 20 นิ้ว,2,5,25,3,25,0.05,58
4,ยางปัดน้ำฝน 22 นิ้ว,2,5,25,3,25,0.05,69
4,ยางปัดน้ำฝน26(รถใหญ่),0,5,25,3,25,0.05,242
4,ยางเพลากลาง KDH 222,1,5,25,3,25,0.05,895
4,ยางเพลากลาง(1200A),0,5,25,3,25,0.05,800
4,ยางรองลำโพง 6 นิ้ว,0,5,25,3,25,0.05,263
2,ยางลบ,58,5,25,3,25,0.05,5
4,ยางหนวดกุ้ง+แหวน KDH222,0,5,25,3,25,0.05,222
4,ยางหูโช๊ค 56112-09400(รถตู้),10,5,25,3,25,0.05,27
4,ยางหูโช๊ค KM,6,5,25,3,25,0.05,37
4,ยางหูโซ็ค 56119-32201(รถตู้),6,5,25,3,25,0.05,27
4,"ยางเหยียบเบรค H/N KL,KM",2,5,25,3,25,0.05,0
5,ยาจุดกันยุง,4,5,25,3,25,0.05,94
5,ยาฉีดยุง,0,5,25,3,25,0.05,50
5,ยาทากันยุง(ซอฟเฟล),33,5,25,3,25,0.05,5
5,ยาล้างแผล(ยาแดง),12,5,25,3,25,0.05,7
5,ยาหม่อง,6,5,25,3,25,0.05,6
3,รสดี,10,5,25,3,25,0.05,93
4,รางเกียร (รถตู้),0,5,25,3,25,0.05,2625
4,รางไฟมิเนียมLEDยาว80 สีฟ้า,6,5,25,3,25,0.05,379
4,ราวเกียร์ ตัวบนยาว (รถตู้),0,5,25,3,25,0.05,2850
4,รีเรย์ 24V,1,5,25,3,25,0.05,105
4,รีเลย์ 5 ขา (24V),3,5,25,3,25,0.05,79
4,ลวดขด,4,5,25,3,25,0.05,0
4,ลวดเชื่อม เบอร์ 2.6,143,5,25,3,25,0.05,4
4,ลวดเชื่อม เบอร์ 3.2,0,5,25,3,25,0.05,5
4,ลวดเชื่อม เบอร์4,0,5,25,3,25,0.05,6
4,ลวดเสียบกระดาษ,0,5,25,3,25,0.05,27
4,ล้อ FS บัส 200 แรง,0,5,25,3,25,0.05,0
4,ล้อรถเข็นของ 10 นิ้ว,0,5,25,3,25,0.05,330
2,ลำโพง,0,5,25,3,25,0.05,1155
2,ลิ้นแฟ้มคละสี (กล่องเล็ก),0,5,25,3,25,0.05,34
2,ลิ้นแฟ้มพลาสติก(ใหญ่),3,5,25,3,25,0.05,100
3,ลิโพ,200,5,25,3,25,0.05,10
3,ลูกเกด,0,5,25,3,25,0.05,147
4,ลูกปืน 6201,10,5,25,3,25,0.05,95
4,ลูกปืน 6301,0,5,25,3,25,0.05,48
4,ลูกปืน 6303 2RS,3,5,25,3,25,0.05,0
4,ลูกปืน 6404R,0,5,25,3,25,0.05,65
4,ลูกปืน LM 48548/10,3,5,25,3,25,0.05,0
4,ลูกปืนก้ามปู HO7D,0,5,25,3,25,0.05,105
4,ลูกปืนครัช VIGO 3.0 4WD KDH223,1,5,25,3,25,0.05,820
4,ลูกปืนคลัช (รถตู้),0,5,25,3,25,0.05,630
4,ลูกปืนปลายเกียร koyo 6210,0,5,25,3,25,0.05,53
4,ลูกปืนไฟวิน 6204R,0,5,25,3,25,0.05,160
4,ลูกปืนรางเกียรตัวกลาง (รถตู้),0,5,25,3,25,0.05,725
4,ลูกปืนรางเกียรบนตัมท้าย (รถตู้),0,5,25,3,25,0.05,515
4,ลูกปืนรางล่างตัมหลัง (รถตู้),0,5,25,3,25,0.05,588
4,ลูกปืนราวกลาง KDH222,0,5,25,3,25,0.05,610
4,ลูกปืนราวเกียร์ ตัวบน,0,5,25,3,25,0.05,510
4,ลูกปืนราวเกียร์ ตัวล่าง,0,5,25,3,25,0.05,570
4,ลูกปืนราวล่าง KDH222,0,5,25,3,25,0.05,570
4,ลูกปืนล้อหน้า NSK,16,5,25,3,25,0.05,1700
4,ลูกปืนล้อหลัง KDH222,8,5,25,3,25,0.05,675
4,ลูกปืนลูกรอก+ปลอก(ล่าง)VIGO,6,5,25,3,25,0.05,578
4,ลูกรอก VIGO 1KZ KDH222,4,5,25,3,25,0.05,0
4,ลูกรอกสายพานพัดลม (กลาง),0,5,25,3,25,0.05,0
4,ลูกรอกสายพานราวลิ้น,10,5,25,3,25,0.05,790
4,ลูกสูบดิสเบรคหน้า VIGO,0,5,25,3,25,0.05,260
4,ลูกหมากกันโคลง KDH222(หน้า),2,5,25,3,25,0.05,360
4,ลูกหมากเกียร์ (ซ้าย)LH10*10,6,5,25,3,25,0.05,79
4,ลูกหมากเกียร์(ขวา)RH10*10,4,5,25,3,25,0.05,79
4,ลูกหมากคันซักสั้น KDH222,2,5,25,3,25,0.05,369
4,ลูกหมากคันเร่ง,18,5,25,3,25,0.05,85
4,ลูกหมากบน VIGO,3,5,25,3,25,0.05,475
4,ลูกหมากปีกนกKDH222(LH),0,5,25,3,25,0.05,1890
4,ลูกหมากปีกนกKDH222(RH),0,5,25,3,25,0.05,1890
4,ลูกหมากแร็ค KDH222( SR-3970),2,5,25,3,25,0.05,610
4,ลูกหมากล่าง KDH222,0,5,25,3,25,0.05,357
3,แลคโตะโซดา,0,5,25,3,25,0.05,15
2,แลตโตะขวดใหญ่,0,5,25,3,25,0.05,20
4,วาล์วโถชายท่อตรง BT-7213,0,5,25,3,25,0.05,293
4,วาล์วหัวจรวด,1,5,25,3,25,0.05,0
3,วุ้นเส้น ตราเกษตรฟ้า,2,5,25,3,25,0.05,59
3,ไวตามิลล์,35,5,25,3,25,0.05,15
5,สก๊อซเทปพันแผล,19,5,25,3,25,0.05,12
1,สก๊อตไบรท์,40,5,25,3,25,0.05,5
2,สติ้กเกอร์ติด พรบ.,0,5,25,3,25,0.05,90
2,สติ้กเกอร์ติดกระสอบ(เล็ก),21,5,25,3,25,0.05,50
2,สติ้กเกอร์ติดกระสอบ(ใหญ่),32,5,25,3,25,0.05,120
4,สปริง+ขากันโคลงหลัง KDH222,0,5,25,3,25,0.05,2650
4,สปริงเบรคหน้า,9,5,25,3,25,0.05,0
3,สปอนเซอร์,96,5,25,3,25,0.05,10
4,สเปรย์กันสนิม (3M),4,5,25,3,25,0.05,111
3,สเปรย์ปรับอากาศ,22,5,25,3,25,0.05,36
2,สมุดบัญชี,4,5,25,3,25,0.05,40
2,สมุดปกอ่อน(เล็ก),9,5,25,3,25,0.05,10
2,สมุดปกอ่อน(ใหญ่),3,5,25,3,25,0.05,13
4,สลักคอม้า KT90M,0,5,25,3,25,0.05,0
4,สลักแหนบหน้า KT 920 1170,0,5,25,3,25,0.05,116
4,สลักแหนบหน้า บัส 200 แรง,0,5,25,3,25,0.05,265
4,สลักแหนบหลัง RR 30-141,0,5,25,3,25,0.05,126
4,สวิทซ์ดึง1ที สั้น,2,5,25,3,25,0.05,90
4,สวิทซ์ดึงหน้า2ที(ใหญ่) EPST,1,5,25,3,25,0.05,0
4,สวิทซ์น้ำมันเครื่อง,0,5,25,3,25,0.05,0
4,สวิทซ์น้ำมันเครื่อง 020571-TGS-61,1,5,25,3,25,0.05,0
4,สวิทซ์ยกเลี้ยว,0,5,25,3,25,0.05,0
4,สวิทซ์ยกเลี้ยว 3T,2,5,25,3,25,0.05,79
4,สวิทซ์หม้อลมเบรค,0,5,25,3,25,0.05,0
4,สวิทต์ไฟถอย KDH 222,6,5,25,3,25,0.05,420
3,ส้อมยาว,5,5,25,3,25,0.05,20
4,สะดือแหนบ KDH222,0,5,25,3,25,0.05,11
4,สะดือแหนบ บัส200 แรง,0,5,25,3,25,0.05,119
4,สะดือแหนบหลัง,0,5,25,3,25,0.05,105
2,สันรูด,11,5,25,3,25,0.05,3
4,สายคันเร่ง KM300 78015-1290,0,5,25,3,25,0.05,255
4,สายเคเบิ้ลไทม์4,0,5,25,3,25,0.05,16
4,สายเคเบิ้ลไทม์8 (หนา),0,5,25,3,25,0.05,42
4,สายแจ๊ค 1เมตร,0,5,25,3,25,0.05,74
4,สายแจ๊ค 5เมตร,0,5,25,3,25,0.05,95
4,สายฉีดชำระ,1,5,25,3,25,0.05,300
4,สายดึงดับ,1,5,25,3,25,0.05,715
4,สายต่อเสาอากาศ,0,5,25,3,25,0.05,158
4,"สายเบรกมือ KDH222(L,R)",0,5,25,3,25,0.05,1850
4,สายเบรคมือ HINO,0,5,25,3,25,0.05,720
4,สายแบ็ต,0,5,25,3,25,0.05,53
4,สายพาน 7PK1473 รถตู้,1,5,25,3,25,0.05,495
4,สายพาน 8870,2,5,25,3,25,0.05,490
4,สายพาน 8890,2,5,25,3,25,0.05,470
4,สายพานเครื่อง VIGO 1516,1,5,25,3,25,0.05,675
4,สายพานราวลิ้น VIGO KDH222,12,5,25,3,25,0.05,630
4,สายไฟเบอร์ 1.5,1,5,25,3,25,0.05,13.7
4,สายไฟเบอร์2*2.5,0,5,25,3,25,0.05,19
4,สายไฟเยอรมัน 2.0m,0,5,25,3,25,0.05,3
4,สายไฟเยอรมัน 6.0 MT,0,5,25,3,25,0.05,0
4,สายยาง 5/8 (ใส),0,5,25,3,25,0.05,8
4,สายยางสีเขียว30เมตร,0,5,25,3,25,0.05,725
4,สายรัดยางยืด,14,5,25,3,25,0.05,15
4,สายลำโพง,0,5,25,3,25,0.05,16
4,สายลำโพง Union,0,5,25,3,25,0.05,16
4,สายแลนด์,0,5,25,3,25,0.05,8
4,สายไฮโรลิค J40640,0,5,25,3,25,0.05,510
4,สาแหรกแหนบ RKM17,1,5,25,3,25,0.05,245
5,สำลีม้วน,5,5,25,3,25,0.05,7
4,สีทากันสนิม(สีเทา),0,5,25,3,25,0.05,99.75
4,สีสเปรย์,0,5,25,3,25,0.05,42
3,เส้นมักกะโรนีเส้นเกลียว,0,5,25,3,25,0.05,79
3,เส้นสปาเก็ตตี้,0,5,25,3,25,0.05,221
3,เส้นหมี่ขาว(ไวไว),1,5,25,3,25,0.05,28
2,เสื้อ AVIA ปักกระเป๋าชาย  XL,0,5,25,3,25,0.05,200
2,เสื้อ AVIA ปักกระเป๋าชาย  XXL,0,5,25,3,25,0.05,300
2,เสื้อ AVIA ปักกระเป๋าชาย (L),0,5,25,3,25,0.05,200
2,เสื้อ AVIA ปักกระเป๋าชาย(M),0,5,25,3,25,0.05,300
2,เสื้อ AVIA ปักกระเป๋าหญิง (L),3,5,25,3,25,0.05,200
2,เสื้อ AVIA ปักกระเป๋าหญิง (S),2,5,25,3,25,0.05,200
2,เสื้อ AVIA ปักกระเป๋าหญิง (XL),9,5,25,3,25,0.05,200
2,เสื้อ AVIA ปักกระเป๋าหญิง(M),0,5,25,3,25,0.05,163
2,เสื้อ แจ็คเก็ต พขร  XXL,1,5,25,3,25,0.05,0
2,เสื้อ แจ็คเก็ต พขร (3XL),2,5,25,3,25,0.05,0
2,เสื้อ แจ็คเก็ต พขร (L),1,5,25,3,25,0.05,0
2,เสื้อ แจ็คเก็ต พขร (M),2,5,25,3,25,0.05,0
2,เสื้อ แจ็คเก็ต พขร (XL),9,5,25,3,25,0.05,0
2,เสื้อ เปรมประชาดำชาย (L),13,5,25,3,25,0.05,200
2,เสื้อ เปรมประชาดำชาย (M),10,5,25,3,25,0.05,200
2,เสื้อ เปรมประชาดำชาย (XL),15,5,25,3,25,0.05,200
2,เสื้อ เปรมประชาดำชาย (XXL),20,5,25,3,25,0.05,300
2,เสื้อ เปรมประชาดำหญิง  L,17,5,25,3,25,0.05,200
2,เสื้อ เปรมประชาดำหญิง  XL,0,5,25,3,25,0.05,200
2,เสื้อ เปรมประชาดำหญิง M,24,5,25,3,25,0.05,200
2,เสื้อกันเปื้อน,0,5,25,3,25,0.05,83
2,เสื้อขับรถพนักงานขับรถสีเทา (XXL),0,5,25,3,25,0.05,305
2,เสื้อแจ๊คเก็ต(เก่า)  L,0,5,25,3,25,0.05,0
2,เสื้อแจ๊คเก็ต(เก่า)  LLL,13,5,25,3,25,0.05,0
2,เสื้อแจ๊คเก็ต(เก่า)  M,0,5,25,3,25,0.05,0
2,เสื้อแจ๊คเก็ต(เก่า)  XL,0,5,25,3,25,0.05,0
2,เสื้อโปโลพนักงานสีเทา(XXL),0,5,25,3,25,0.05,315
2,เสื้อพนักงาน PC สีน้ำเงิน (XL ชาย),0,5,25,3,25,0.05,200
2,เสื้อพนักงาน PC สีน้ำเงิน (XXLชาย),2,5,25,3,25,0.05,140
2,เสื้อพนักงาน PC สีน้ำเงิน(เก่า) L,0,5,25,3,25,0.05,0
2,เสื้อพนักงาน PC สีน้ำเงิน(เก่า) M,0,5,25,3,25,0.05,0
2,เสื้อพนักงาน PC สีน้ำเงิน(เก่า) XL,0,5,25,3,25,0.05,0
2,เสื้อพนักงานเก็บค่าโดยสาร (M),0,5,25,3,25,0.05,315
2,เสื้อพนักงานเก็บค่าโดยสาร (XL),0,5,25,3,25,0.05,315
2,เสื้อพนักงานเก็บค่าโดยสาร (เก่า) L,0,5,25,3,25,0.05,0
2,เสื้อพนักงานเก็บค่าโดยสาร (เก่า) XL,0,5,25,3,25,0.05,0
2,เสื้อพนักงานเก็บค่าโดยสาร (เก่า) XXL,0,5,25,3,25,0.05,0
2,เสื้อพนักงานขับรถ(เก่า) L,0,5,25,3,25,0.05,0
2,เสื้อพนักงานขับรถ(เก่า) M,0,5,25,3,25,0.05,0
2,เสื้อพนักงานขับรถสีเทา (3XL),2,5,25,3,25,0.05,315
2,เสื้อพนักงานขับรถสีเทา (L),0,5,25,3,25,0.05,300
2,เสื้อพนักงานขับรถสีเทา (M),0,5,25,3,25,0.05,300
2,เสื้อพนักงานขับรถสีเทา (S),0,5,25,3,25,0.05,300
2,เสื้อพนักงานขับรถสีเทา (XL),1,5,25,3,25,0.05,300
2,เสื้อพนักงานขับรถสีเทา (XXL),4,5,25,3,25,0.05,300
2,เสื้อพนักงานขับรถสีเทา( LLL),13,5,25,3,25,0.05,300
2,เสื้อพนักงานสีส้มเก่า,0,5,25,3,25,0.05,0
4,เสื้อไฟหน้าซ้าย(รถตู้),1,5,25,3,25,0.05,3481
3,เสื้อยืดคอกลม สีขาว L(เก่า),0,5,25,3,25,0.05,0
2,เสื้อยืดคอกลม(สีขาว),0,5,25,3,25,0.05,315
3,ไส้กรอก,0,5,25,3,25,0.05,104
